{
  "schema_version": "1.0.0",
  "patch_id": "patch_consultco_fixture_d",
  "organization_id": "org_consultco",
  "base_snapshot": 1,
  "decision_id": "dec_consultco_v1",
  "solution_plan_id": "plan_5a682ec42084ae355a2d",
  "status": "PROPOSED",
  "operations": [
    {
      "op": "ADD_PRODUCT_INSTANCE",
      "instance": {
        "instance_id": "inst_fixture_d_consultco",
        "product_id": "product_fixture_d",
        "product_version": "product_fixture_d_v1",
        "offer_id": "offer_fixture_d_monthly",
        "lifecycle": "staged",
        "serves": [
          "capture_meeting_decisions"
        ],
        "owners": [
          "operations_owner"
        ],
        "users": [
          "consultants"
        ],
        "cost": {
          "amount": "89.00",
          "currency": "USD",
          "interval": "monthly"
        },
        "dependencies": [
          "google_workspace",
          "slack",
          "zoom"
        ],
        "entitlement_id": "ent_fixture_d_workspace"
      }
    },
    {
      "op": "ADD_EDGE",
      "edge": {
        "from": "product_fixture_d",
        "type": "integrates_with",
        "to": "google_workspace",
        "criticality": "high"
      }
    },
    {
      "op": "ADD_EDGE",
      "edge": {
        "from": "product_fixture_d",
        "type": "integrates_with",
        "to": "slack",
        "criticality": "medium"
      }
    },
    {
      "op": "ADD_EDGE",
      "edge": {
        "from": "product_fixture_d",
        "type": "integrates_with",
        "to": "zoom",
        "criticality": "high"
      }
    },
    {
      "op": "ADD_EDGE",
      "edge": {
        "from": "capture_meeting_decisions",
        "type": "fulfilled_by",
        "to": "product_fixture_d",
        "criticality": "high"
      }
    }
  ],
  "prerequisites": [
    "Exact Purchase Intent approval is current.",
    "Payment reaches PRAVA_COMPLETED.",
    "Workspace and ten-seat entitlements are verified."
  ],
  "rollback_plan": [
    "Do not activate the staged instance if entitlement verification fails.",
    "Revoke the staged instance and integration edges after a confirmed full refund."
  ],
  "cost_impact": {
    "monthly_delta": "89.00",
    "currency": "USD"
  },
  "risk": "LOW",
  "expected_outcome": "Consultants can retrieve an agreed client decision, owner, and source moment within 120 seconds.",
  "created_at": "2026-08-02T01:05:00Z",
  "content_hash": "sha256:880d32891bd88aa9c11ff30a01d7e8591410f4085cfc0e7ea1a28d21e059cdbb"
}
